{
  "success": true,
  "code": "OK",
  "message": "ok",
  "data": {
    "status": "checked",
    "summary": {
      "input_rows": 12,
      "accepted_rows": 12,
      "rejected_rows": 0,
      "error_count": 0,
      "warning_count": 0,
      "warnings_need_review": false,
      "schema_ready": true,
      "synthetic_fixture_present": true,
      "source_provenance": "Input data_origin declarations are not independent verification",
      "output_current_convention": "discharge_positive",
      "output_time": "UTC with explicit Z",
      "model_inference_performed": false,
      "scope": "Core telemetry + metadata only; full cell/probe/events tables not validated in V0.2",
      "interpretation": "Data quality screening only; not a battery safety pass or vehicle SOH/RUL validation"
    },
    "accepted": [
      {
        "battery_id": "SYNTHETIC_PACK_001",
        "timestamp": "2025-12-31T16:00:00.000000Z",
        "pack_voltage": 320.0,
        "pack_current": 10.0,
        "SOC": 60.0,
        "cell_voltage_max": 3.4,
        "cell_voltage_min": 3.3,
        "temperature_max": 30.0,
        "temperature_min": 25.0,
        "charge_status": "discharging",
        "mileage": 100.0,
        "pack_current_raw": 10.0,
        "source_csv_row": 2
      },
      {
        "battery_id": "SYNTHETIC_PACK_001",
        "timestamp": "2025-12-31T16:00:10.000000Z",
        "pack_voltage": 319.9,
        "pack_current": 10.0,
        "SOC": 59.99,
        "cell_voltage_max": 3.4,
        "cell_voltage_min": 3.3,
        "temperature_max": 30.0,
        "temperature_min": 25.0,
        "charge_status": "discharging",
        "mileage": 100.01,
        "pack_current_raw": 10.0,
        "source_csv_row": 3
      },
      {
        "battery_id": "SYNTHETIC_PACK_001",
        "timestamp": "2025-12-31T16:00:20.000000Z",
        "pack_voltage": 319.8,
        "pack_current": 10.0,
        "SOC": 59.98,
        "cell_voltage_max": 3.4,
        "cell_voltage_min": 3.3,
        "temperature_max": 30.0,
        "temperature_min": 25.0,
        "charge_status": "discharging",
        "mileage": 100.02,
        "pack_current_raw": 10.0,
        "source_csv_row": 4
      },
      {
        "battery_id": "SYNTHETIC_PACK_001",
        "timestamp": "2025-12-31T16:00:30.000000Z",
        "pack_voltage": 319.7,
        "pack_current": 10.0,
        "SOC": 59.97,
        "cell_voltage_max": 3.4,
        "cell_voltage_min": 3.3,
        "temperature_max": 30.0,
        "temperature_min": 25.0,
        "charge_status": "discharging",
        "mileage": 100.03,
        "pack_current_raw": 10.0,
        "source_csv_row": 5
      },
      {
        "battery_id": "SYNTHETIC_PACK_001",
        "timestamp": "2025-12-31T16:00:40.000000Z",
        "pack_voltage": 319.6,
        "pack_current": 10.0,
        "SOC": 59.96,
        "cell_voltage_max": 3.4,
        "cell_voltage_min": 3.3,
        "temperature_max": 30.0,
        "temperature_min": 25.0,
        "charge_status": "discharging",
        "mileage": 100.04,
        "pack_current_raw": 10.0,
        "source_csv_row": 6
      },
      {
        "battery_id": "SYNTHETIC_PACK_001",
        "timestamp": "2025-12-31T16:00:50.000000Z",
        "pack_voltage": 319.5,
        "pack_current": 10.0,
        "SOC": 59.95,
        "cell_voltage_max": 3.4,
        "cell_voltage_min": 3.3,
        "temperature_max": 30.0,
        "temperature_min": 25.0,
        "charge_status": "discharging",
        "mileage": 100.05,
        "pack_current_raw": 10.0,
        "source_csv_row": 7
      },
      {
        "battery_id": "SYNTHETIC_PACK_001",
        "timestamp": "2025-12-31T16:01:00.000000Z",
        "pack_voltage": 319.4,
        "pack_current": 10.0,
        "SOC": 59.94,
        "cell_voltage_max": 3.4,
        "cell_voltage_min": 3.3,
        "temperature_max": 30.0,
        "temperature_min": 25.0,
        "charge_status": "discharging",
        "mileage": 100.06,
        "pack_current_raw": 10.0,
        "source_csv_row": 8
      },
      {
        "battery_id": "SYNTHETIC_PACK_001",
        "timestamp": "2025-12-31T16:01:10.000000Z",
        "pack_voltage": 319.3,
        "pack_current": 10.0,
        "SOC": 59.93,
        "cell_voltage_max": 3.4,
        "cell_voltage_min": 3.3,
        "temperature_max": 30.0,
        "temperature_min": 25.0,
        "charge_status": "discharging",
        "mileage": 100.07,
        "pack_current_raw": 10.0,
        "source_csv_row": 9
      },
      {
        "battery_id": "SYNTHETIC_PACK_001",
        "timestamp": "2025-12-31T16:01:20.000000Z",
        "pack_voltage": 319.2,
        "pack_current": 10.0,
        "SOC": 59.92,
        "cell_voltage_max": 3.4,
        "cell_voltage_min": 3.3,
        "temperature_max": 30.0,
        "temperature_min": 25.0,
        "charge_status": "discharging",
        "mileage": 100.08,
        "pack_current_raw": 10.0,
        "source_csv_row": 10
      },
      {
        "battery_id": "SYNTHETIC_PACK_001",
        "timestamp": "2025-12-31T16:01:30.000000Z",
        "pack_voltage": 319.1,
        "pack_current": 10.0,
        "SOC": 59.91,
        "cell_voltage_max": 3.4,
        "cell_voltage_min": 3.3,
        "temperature_max": 30.0,
        "temperature_min": 25.0,
        "charge_status": "discharging",
        "mileage": 100.09,
        "pack_current_raw": 10.0,
        "source_csv_row": 11
      },
      {
        "battery_id": "SYNTHETIC_PACK_001",
        "timestamp": "2025-12-31T16:01:40.000000Z",
        "pack_voltage": 319.0,
        "pack_current": 10.0,
        "SOC": 59.9,
        "cell_voltage_max": 3.4,
        "cell_voltage_min": 3.3,
        "temperature_max": 30.0,
        "temperature_min": 25.0,
        "charge_status": "discharging",
        "mileage": 100.1,
        "pack_current_raw": 10.0,
        "source_csv_row": 12
      },
      {
        "battery_id": "SYNTHETIC_PACK_001",
        "timestamp": "2025-12-31T16:01:50.000000Z",
        "pack_voltage": 318.9,
        "pack_current": 10.0,
        "SOC": 59.89,
        "cell_voltage_max": 3.4,
        "cell_voltage_min": 3.3,
        "temperature_max": 30.0,
        "temperature_min": 25.0,
        "charge_status": "discharging",
        "mileage": 100.11,
        "pack_current_raw": 10.0,
        "source_csv_row": 13
      }
    ],
    "rejected": [],
    "issues": [],
    "normalized_metadata": [
      {
        "battery_id": "SYNTHETIC_PACK_001",
        "battery_chemistry": "LFP",
        "rated_capacity_ah": 100,
        "current_sign_convention": "discharge_positive",
        "voltage_unit": "V",
        "current_unit": "A",
        "temperature_unit": "degC",
        "soc_unit": "%",
        "data_origin": "synthetic_fixture"
      }
    ]
  },
  "error": null,
  "request_id": "4e6fc5e0bd88417cad82e48d734c342a",
  "schema_version": "1.0",
  "warnings": [
    "比赛 Demo / 原型；尚未完成真实车辆验证，不能替代正式检测报告。",
    "SOH/RUL 为公开 NASA 电芯数据验证；RUL 依赖实测容量和工况，不能解释为剩余天数。",
    "Demo / Prototype Parameters：退役决策权重、安全阈值、价格与路径参数均未经行业验证。",
    "SHAP 解释模型预测贡献，不证明物理衰减因果；公开电芯结果不自动用于电池包决策。",
    "碳因子受年份、地区和系统边界影响，调用方声明的来源不等于独立核验。"
  ]
}